{
  "abi_version": "1",
  "authorities": {
    "domain_failure_states": {
      "exports": [
        "DomainFailureStateMachine"
      ],
      "implementation_sha256": "c113483422c02f5630b22d40b32c77d305feec94918bbca622b570fcead344c4",
      "python_file": "failure_states\\canonical_domain_states.py",
      "qualification_evidence": [
        {
          "path": "16_Test_Qualification/evidence/ENTITY_DOMAIN_INTERNAL_QUALIFICATION_CURRENT.json",
          "sha256": "0fa336744ca7d6bb5ecea29a717938d68c85d39efd5de7c4646a67e1f0170985",
          "status": "PASS"
        }
      ],
      "status": "READY"
    },
    "domain_migration": {
      "exports": [
        "DomainMigrationManager"
      ],
      "implementation_sha256": "0cd3196f0383a09bda5da03b05ff7dcb06cb5015296729b4cbd8522f58da2b8a",
      "python_file": "migration\\canonical_domain_migration.py",
      "qualification_evidence": [
        {
          "path": "16_Test_Qualification/evidence/ENTITY_DOMAIN_INTERNAL_QUALIFICATION_CURRENT.json",
          "sha256": "0fa336744ca7d6bb5ecea29a717938d68c85d39efd5de7c4646a67e1f0170985",
          "status": "PASS"
        }
      ],
      "status": "READY"
    },
    "domain_node_runtime": {
      "exports": [
        "EntityNodeRuntime",
        "EntityDirectClient"
      ],
      "implementation_sha256": "f21b4d9caabd6b609aa237ae744fc53944eaa22d3f1acd2f5ca41971f22c0443",
      "python_file": "node_runtime\\canonical_node_runtime.py",
      "qualification_evidence": [
        {
          "path": "16_Test_Qualification/evidence/ENTITY_DOMAIN_INTERNAL_QUALIFICATION_CURRENT.json",
          "sha256": "0fa336744ca7d6bb5ecea29a717938d68c85d39efd5de7c4646a67e1f0170985",
          "status": "PASS"
        }
      ],
      "status": "READY"
    },
    "domain_portability": {
      "exports": [
        "DomainPortabilityManager"
      ],
      "implementation_sha256": "c5c17a583a57b5dbc1d69ad3b161519eb394beb75c51c7cfeae72311ff5747dc",
      "python_file": "portability\\canonical_domain_portability.py",
      "qualification_evidence": [
        {
          "path": "16_Test_Qualification/evidence/ENTITY_DOMAIN_INTERNAL_QUALIFICATION_CURRENT.json",
          "sha256": "0fa336744ca7d6bb5ecea29a717938d68c85d39efd5de7c4646a67e1f0170985",
          "status": "PASS"
        }
      ],
      "status": "READY"
    },
    "domain_presence": {
      "exports": [
        "PresenceAdvertisementManager"
      ],
      "implementation_sha256": "3192402e5cec0d24fd4d687bd14bf1439e3ae932ccfa0aec292b8155cf552fa7",
      "python_file": "presence\\canonical_presence.py",
      "qualification_evidence": [
        {
          "path": "16_Test_Qualification/evidence/ENTITY_DOMAIN_INTERNAL_QUALIFICATION_CURRENT.json",
          "sha256": "0fa336744ca7d6bb5ecea29a717938d68c85d39efd5de7c4646a67e1f0170985",
          "status": "PASS"
        }
      ],
      "status": "READY"
    },
    "domain_recovery": {
      "exports": [
        "DomainRecoveryManager"
      ],
      "implementation_sha256": "2cbc78559bffdbcd77bdab151a2b62d9f3c60428d2aaffdc87829666da835a61",
      "python_file": "recovery\\canonical_domain_recovery.py",
      "qualification_evidence": [
        {
          "path": "16_Test_Qualification/evidence/ENTITY_DOMAIN_INTERNAL_QUALIFICATION_CURRENT.json",
          "sha256": "0fa336744ca7d6bb5ecea29a717938d68c85d39efd5de7c4646a67e1f0170985",
          "status": "PASS"
        }
      ],
      "status": "READY"
    },
    "domain_relay": {
      "exports": [
        "OpaqueDomainRelay"
      ],
      "implementation_sha256": "a6677ab8c7426b9cdea0d654966fbf27fb623b4335e0a9beb6a1db8d22aea039",
      "python_file": "protocols\\canonical_domain_relay.py",
      "qualification_evidence": [
        {
          "path": "16_Test_Qualification/evidence/ENTITY_DOMAIN_INTERNAL_QUALIFICATION_CURRENT.json",
          "sha256": "0fa336744ca7d6bb5ecea29a717938d68c85d39efd5de7c4646a67e1f0170985",
          "status": "PASS"
        }
      ],
      "status": "READY"
    },
    "domain_resolution": {
      "exports": [
        "EntityNativeResolver"
      ],
      "implementation_sha256": "38d7b9b5eb4d46a70c0fdc7b5be077c73e92ca0326fb6552a54b16f23a708705",
      "python_file": "resolution\\canonical_resolution.py",
      "qualification_evidence": [
        {
          "path": "16_Test_Qualification/evidence/ENTITY_DOMAIN_INTERNAL_QUALIFICATION_CURRENT.json",
          "sha256": "0fa336744ca7d6bb5ecea29a717938d68c85d39efd5de7c4646a67e1f0170985",
          "status": "PASS"
        }
      ],
      "status": "READY"
    },
    "sovereign_domain": {
      "exports": [
        "EntityDomainAuthority"
      ],
      "implementation_sha256": "445f08903c34d33e5bcef09f6f40c14646c2236ab4a4d2b1a28da367c34b8f70",
      "python_file": "core\\canonical_domain.py",
      "qualification_evidence": [
        {
          "path": "16_Test_Qualification/evidence/ENTITY_DOMAIN_INTERNAL_QUALIFICATION_CURRENT.json",
          "sha256": "0fa336744ca7d6bb5ecea29a717938d68c85d39efd5de7c4646a67e1f0170985",
          "status": "PASS"
        }
      ],
      "status": "READY"
    }
  },
  "implementation_version": "1.0.0-sers-entity-domain-001",
  "requirements_sha256": "44ec8d35aff4fb0e0c0d1c227c54190d0b0d33bd5f48e9c5bfec844ddc3ee118",
  "schema": "entity-runtime-binding-v1",
  "schema_versions": [
    "entity-domain-v1",
    "entity-node-authorization-v1",
    "entity-service-manifest-v1",
    "entity-presence-advertisement-v1",
    "entity-resolution-proof-v1",
    "entity-domain-export-package-v1"
  ],
  "status": "READY"
}
